<?xml version="1.0" encoding="UTF-8"?>
<xs:schema xmlns:xs="http://www.w3.org/2001/XMLSchema">

    <xs:element name="inventario">
        <xs:complexType>
            <xs:sequence>
                <xs:element name="dispositivo" maxOccurs="unbounded">
                    <xs:complexType>
                        <xs:sequence>
                            <xs:element name="id" type="xs:integer"/>
                            <xs:element name="tipo" type="xs:string"/>
                            <xs:element name="marca" type="xs:string"/>
                            <xs:element name="modelo" type="xs:string"/>
                            <xs:element name="precio" type="xs:decimal"/>
                        </xs:sequence>
                    </xs:complexType>
                </xs:element>
            </xs:sequence>
        </xs:complexType>
    </xs:element>

</xs:schema>